<?xml version="1.0" encoding="UTF-8"?>
<!DOCTYPE dictionary SYSTEM "dictionary.dtd">

<dictionary>

<!-- TS 29.061-840: Interworking between the PLMN supporting packet based services and PDN -->
<!-- ************* DIAMETER GiSGi Application ************* -->
<application id="1" name="Gi/SGi" uri="http://www.3gpp.org/DynaReport/29061.htm">
	<command name="AA" abbreviation="AA" code="265" applicatoin-id="1" proxiable="1">
		<requestrules>
			<!--TODO-->
		</requestrules>
		<answerrules>
			<!--TODO-->
		</answerrules>
	</command>
	<command name="Accounting" abbreviation="AC" code="271" applicatoin-id="3" proxiable="1">
		<requestrules>
			<!--TODO-->
		</requestrules>
		<answerrules>
			<!--TODO-->
		</answerrules>
	</command>
	<command name="Session-Termination" abbreviation="ST" code="275" applicatoin-id="0" proxiable="1">
		<requestrules>
			<!--TODO-->
		</requestrules>
		<answerrules>
			<!--TODO-->
		</answerrules>
	</command>
	<command name="Abort-Session" abbreviation="AA" code="274" application-id="0" proxiable="1">
		<requestrules>
			<!--TODO-->
		</requestrules>
		<answerrules>
			<!--TODO-->
		</answerrules>
	</command>
</application>

</dictionary>
