<?xml version="1.0" encoding="UTF-8"?>
<!DOCTYPE dictionary SYSTEM "dictionary.dtd">

<dictionary>
	<!-- ************* DIAMETER T4 APPLICATION ************* -->
	<!-- TS 29.337-d20: Diameter-based T4 interface for communications with packet data networks and applications -->

	<application id="16777311" name="T4" uri="http://www.3gpp.org/DynaReport/29337.htm">
		<command name="Device-Trigger-Request" code="8388643" abbreviation="DT" application-id="16777311" proxiable="yes">
			<requestrules>
				<fixed>
					<avprule name="Session-Id" maximum="1" minimum="1"/>
				</fixed>
				<required>
					<avprule name="Auth-Session-State" maximum="1" minimum="1"/>
					<avprule name="Origin-Host" maximum="1" minimum="1"/>
					<avprule name="Origin-Realm" maximum="1" minimum="1"/>
					<avprule name="Destination-Realm" maximum="1" minimum="1"/>
					<avprule name="User-Identifier" maximum="1" minimum="1" trace_id="true"/>
					<avprule name="SM-RP-SMEA" maximum="1" minimum="1"/>
					<avprule name="Payload" maximum="1" minimum="1"/>
				</required>
				<optional>
					<avprule name="DRMP" maximum="1"/>
					<avprule name="Destination-Host" maximum="1"/>
					<avprule name="Serving-Node" maximum="1"/>
					<avprule name="Additional-Serving-Node" maximum="1"/>
					<avprule name="Reference-Number" maximum="1"/>
					<avprule name="Validity-Time" maximum="1"/>
					<avprule name="Priority-Indication" maximum="1"/>
					<!--
					<avprule name="Application-Port-Identifier" maximum="1"/>
					-->
					<avprule name="SMS-Application-Port-ID" maximum="1"/>
					<avprule name="Old-Reference-Number" maximum="1"/>
					<avprule name="Trigger-Action" maximum="1"/>
					<avprule name="Supported-Features"/>
					<avprule name="Proxy-Info"/>
					<avprule name="Route-Record"/>
					<avprule name="AVP"/>
				</optional>
			</requestrules>
			<answerrules>
				<fixed>
					<avprule name="Session-Id" maximum="1" minimum="1"/>
				</fixed>
				<required>
					<avprule name="Auth-Session-State" maximum="1" minimum="1"/>
					<avprule name="Origin-Host" maximum="1" minimum="1"/>
					<avprule name="Origin-Realm" maximum="1" minimum="1"/>
				</required>
				<optional>
					<avprule name="DRMP" maximum="1"/>
					<avprule name="Vendor-Specific-Application-Id" maximum="1"/>
					<avprule name="Result-Code" maximum="1"/>
					<avprule name="Experimental-Result" maximum="1"/>
					<avprule name="MTC-Error-Diagnostic" maximum="1"/>
					<avprule name="Old-Reference-Number" maximum="1"/>
					<avprule name="Trigger-Action" maximum="1"/>
					<avprule name="Supported-Features"/>
					<avprule name="Failed-AVP"/>
					<avprule name="Proxy-Info"/>
					<avprule name="Route-Record"/>
					<avprule name="AVP"/>
				</optional>
			</answerrules>
		</command>
		<command name="Delivery-Report" code="8388644" abbreviation="DR" application-id="16777311" proxiable="yes">
			<requestrules>
				<fixed>
					<avprule name="Session-Id" maximum="1" minimum="1"/>
				</fixed>
				<required>
					<avprule name="Auth-Session-State" maximum="1" minimum="1"/>
					<avprule name="Origin-Host" maximum="1" minimum="1"/>
					<avprule name="Origin-Realm" maximum="1" minimum="1"/>
					<avprule name="Destination-Host" maximum="1" minimum="1"/>
					<avprule name="Destination-Realm" maximum="1" minimum="1"/>
					<avprule name="User-Identifier" maximum="1" minimum="1"/>
					<avprule name="SM-RP-SMEA" maximum="1" minimum="1"/>
					<avprule name="SM-Delivery-Outcome-T4" maximum="1" minimum="1"/>
				</required>
				<optional>
					<avprule name="DRMP" maximum="1"/>
					<avprule name="Absent-Subscriber-Diagnostic-T4" maximum="1"/>
					<avprule name="Reference-Number" maximum="1"/>
					<avprule name="Supported-Features"/>
					<avprule name="Failed-AVP"/>
					<avprule name="Proxy-Info"/>
					<avprule name="Route-Record"/>
					<avprule name="AVP"/>
				</optional>
			</requestrules>
			<answerrules>
				<fixed>
					<avprule name="Session-Id" maximum="1" minimum="1"/>
				</fixed>
				<required>
					<avprule name="Auth-Session-State" maximum="1" minimum="1"/>
					<avprule name="Origin-Host" maximum="1" minimum="1"/>
					<avprule name="Origin-Realm" maximum="1" minimum="1"/>
				</required>
				<optional>
					<avprule name="DRMP" maximum="1"/>
					<avprule name="Vendor-Specific-Application-Id" maximum="1"/>
					<avprule name="Result-Code" maximum="1"/>
					<avprule name="Experimental-Result" maximum="1"/>
					<avprule name="Supported-Features"/>
					<avprule name="Failed-AVP"/>
					<avprule name="Proxy-Info"/>
					<avprule name="Route-Record"/>
					<avprule name="AVP"/>
				</optional>
			</answerrules>
		</command>
	</application>
</dictionary>
