<?xml version="1.0" encoding="UTF-8"?>
<!DOCTYPE dictionary SYSTEM "dictionary.dtd">

<dictionary>

	<!-- ************* DIAMETER Rx APPLICATION ************* -->
	<application id="16777236" name="Rx" uri="http://www.3gpp.org/DynaReport/29214.htm">
		<command name="AA" code="265" application-id="16777236" abbreviation="AA">
			<requestrules>
				<fixed>
					<avprule name="Session-Id" maximum="1" minimum="1"/>
				</fixed>
				<required>
					<avprule name="Auth-Application-Id" maximum="1" minimum="1"/>
					<avprule name="Origin-Host" maximum="1" minimum="1"/>
					<avprule name="Origin-Realm" maximum="1" minimum="1"/>
					<avprule name="Destination-Realm" maximum="1" minimum="1"/>
				</required>
				<optional>
					<avprule name="Destination-Host" maximum="1"/>
					<avprule name="IP-Domain-Id" maximum="1"/>
					<avprule name="AF-Application-Identifier" maximum="1"/>
					<avprule name="Media-Component-Description"/>
					<avprule name="Service-Info-Status" maximum="1"/>
					<avprule name="AF-Charging-Identifier" maximum="1"/>
					<avprule name="SIP-Forking-Indication" maximum="1"/>
					<avprule name="Specific-Action"/>
					<avprule name="Subscription-Id" trace_id="yes"/>
					<avprule name="Supported-Features"/>
					<avprule name="Reservation-Priority" maximum="1"/>
					<avprule name="Framed-IP-Address" maximum="1"/>
					<avprule name="Framed-IPv6-Prefix" maximum="1"/>
					<avprule name="Called-Station-Id" maximum="1"/>
					<avprule name="Service-URN" maximum="1"/>
					<avprule name="Sponsored-Connectivity-Data" maximum="1"/>
					<avprule name="MPS-Identifier" maximum="1"/>
					<avprule name="Rx-Request-Type" maximum="1"/>
					<avprule name="Required-Access-Info"/>
					<avprule name="Origin-State-Id" maximum="1"/>
					<avprule name="Proxy-Info"/>
					<avprule name="Route-Record"/>
					<avprule name="AVP"/>
				</optional>
			</requestrules>
			<answerrules>
				<fixed>
					<avprule name="Session-Id" maximum="1" minimum="1"/>
				</fixed>
				<required>
					<avprule name="Auth-Application-Id" maximum="1" minimum="1"/>
					<avprule name="Origin-Host" maximum="1" minimum="1"/>
					<avprule name="Origin-Realm" maximum="1" minimum="1"/>
				</required>
				<optional>
					<avprule name="Result-Code" maximum="1" />
					<avprule name="Experimental-Result" maximum="1" />
					<avprule name="Access-Network-Charging-Identifier"/>
					<avprule name="Access-Network-Charging-Address" maximum="1" />
					<avprule name="Acceptable-Service-Info" maximum="1" />
					<avprule name="IP-CAN-Type" maximum="1" />
					<avprule name="NetLoc-Access-Support" maximum="1" />
					<avprule name="RAT-Type" maximum="1" />
					<avprule name="Flows" />
					<avprule name="Supported-Features" />
					<avprule name="Class" />
					<avprule name="Error-Message" maximum="1" />
					<avprule name="Error-Reporting-Host" maximum="1" />
					<avprule name="Failed-AVP" />
					<avprule name="Origin-State-Id" maximum="1" />
					<avprule name="Redirect-Host"/>
					<avprule name="Redirect-Host-Usage" maximum="1" />
					<avprule name="Redirect-Max-Cache-Time" maximum="1" />
					<avprule name="Proxy-Info"/>
					<avprule name="AVP"/>
				</optional>
			</answerrules>
		</command>

		<command name="Re-Auth" code="258" application-id="16777236" abbreviation="RA">
			<requestrules>
				<fixed>
					<avprule name="Session-Id" maximum="1" minimum="1"/>
				</fixed>
				<required>
					<avprule name="Origin-Host" maximum="1" minimum="1"/>
					<avprule name="Origin-Realm" maximum="1" minimum="1"/>
					<avprule name="Destination-Realm" maximum="1" minimum="1"/>
					<avprule name="Destination-Host" maximum="1" minimum="1"/>
					<avprule name="Auth-Application-Id" maximum="1" minimum="1"/>
					<avprule name="Specific-Action" minimum="1"/>
				</required>
				<optional>
					<avprule name="Access-Network-Charging-Identifier"/>
					<avprule name="Access-Network-Charging-Address" maximum="1"/>
					<avprule name="Flows" />
					<avprule name="Subscription-Id" trace_id="yes"/>
					<avprule name="Abort-Cause" maximum="1"/>
					<avprule name="IP-CAN-Type" maximum="1"/>
					<avprule name="NetLoc-Access-Support" maximum="1"/>
					<avprule name="RAT-Type" maximum="1"/>
					<avprule name="Sponsored-Connectivity-Data" maximum="1"/>
					<avprule name="3GPP-User-Location-Info" maximum="1"/>
					<avprule name="User-Location-Info-Time" maximum="1"/>
					<avprule name="3GPP-MS-TimeZone" maximum="1"/>
					<avprule name="3GPP-SGSN-MCC-MNC" maximum="1"/>
					<avprule name="Origin-State-Id" maximum="1"/>
					<avprule name="Class" />
					<avprule name="Proxy-Info"/>
					<avprule name="Route-Record"/>
					<avprule name="AVP"/>
				</optional>
			</requestrules>
			<answerrules>
				<fixed>
					<avprule name="Session-Id" maximum="1" minimum="1"/>
				</fixed>
				<required>
					<avprule name="Origin-Host" maximum="1" minimum="1"/>
					<avprule name="Origin-Realm" maximum="1" minimum="1"/>
				</required>
				<optional>
					<avprule name="Result-Code" maximum="1" />
					<avprule name="Experimental-Result" maximum="1" />
					<avprule name="Media-Component-Description" />
					<avprule name="Service-URN" maximum="1" />
					<avprule name="Origin-State-Id" maximum="1"/>
					<avprule name="Class" />
					<avprule name="Error-Message" maximum="1"/>
					<avprule name="Error-Reporting-Host" maximum="1"/>
					<avprule name="Redirect-Host"/>
					<avprule name="Redirect-Host-Usage" maximum="1"/>
					<avprule name="Redirect-Max-Cache-Time" maximum="1"/>
					<avprule name="Failed-AVP"/>
					<avprule name="Proxy-Info"/>
					<avprule name="AVP"/>
				</optional>
			</answerrules>
		</command>

		<command name="Session-Termination" application-id="16777236" code="275" abbreviation="ST">
			<requestrules>
				<fixed>
					<avprule name="Session-Id" maximum="1" minimum="1"/>
				</fixed>
				<required>
					<avprule name="Origin-Host" maximum="1" minimum="1"/>
					<avprule name="Origin-Realm" maximum="1" minimum="1"/>
					<avprule name="Destination-Realm" maximum="1" minimum="1"/>
					<avprule name="Auth-Application-Id" maximum="1" minimum="1"/>
					<avprule name="Termination-Cause" maximum="1" minimum="1"/>
				</required>
				<optional>
					<avprule name="Destination-Host" maximum="1"/>
					<avprule name="Required-Access-Info"/>
					<avprule name="Class"/>
					<avprule name="Origin-State-Id" maximum="1"/>
					<avprule name="Proxy-Info"/>
					<avprule name="Route-Record"/>
					<avprule name="AVP"/>
				</optional>
			</requestrules>
			<answerrules>
				<fixed>
					<avprule name="Session-Id" maximum="1" minimum="1"/>
				</fixed>
				<required>
					<avprule name="Origin-Host" maximum="1" minimum="1"/>
					<avprule name="Origin-Realm" maximum="1" minimum="1"/>
				</required>
				<optional>
					<avprule name="Result-Code" maximum="1" minimum="1"/>
					<avprule name="Error-Message" maximum="1"/>
					<avprule name="Error-Reporting-Host" maximum="1"/>
					<avprule name="Failed-AVP"/>
					<avprule name="Sponsored-Connectivity-Data" maximum="1"/>
					<avprule name="Origin-State-Id" maximum="1"/>
					<avprule name="3GPP-User-Location-Info" maximum="1"/>
					<avprule name="User-Location-Info-Time" maximum="1"/>
					<avprule name="3GPP-MS-TimeZone" maximum="1"/>
					<avprule name="3GPP-SGSN-MCC-MNC" maximum="1"/>
					<avprule name="NetLoc-Access-Support" maximum="1" />
					<avprule name="Class"/>
					<avprule name="Redirect-Host"/>
					<avprule name="Redirect-Host-Usage" maximum="1"/>
					<avprule name="Redirect-Max-Cache-Time" maximum="1"/>
					<avprule name="Proxy-Info"/>
					<avprule name="AVP"/>
				</optional>
			</answerrules>
		</command>
		<command name="Abort-Session" code="274" application-id="16777236" abbreviation="AS">
			<requestrules>
				<fixed>
					<avprule name="Session-Id" maximum="1" minimum="1"/>
				</fixed>
				<required>
					<avprule name="Origin-Host" maximum="1" minimum="1"/>
					<avprule name="Origin-Realm" maximum="1" minimum="1"/>
					<avprule name="Destination-Realm" maximum="1" minimum="1"/>
					<avprule name="Destination-Host" maximum="1" minimum="1"/>
					<avprule name="Auth-Application-Id" maximum="1" minimum="1"/>
				</required>
				<optional>
					<avprule name="Abort-Cause" maximum="1"/>
					<avprule name="Origin-State-Id" maximum="1"/>
					<avprule name="Proxy-Info"/>
					<avprule name="Route-Record"/>
					<avprule name="AVP"/>
				</optional>
			</requestrules>
			<answerrules>
				<fixed>
					<avprule name="Session-Id" maximum="1" minimum="1"/>
				</fixed>
				<required>
					<avprule name="Result-Code" maximum="1" minimum="1"/>
					<avprule name="Origin-Host" maximum="1" minimum="1"/>
					<avprule name="Origin-Realm" maximum="1" minimum="1"/>
				</required>
				<optional>
					<avprule name="User-Name" maximum="1"/>
					<avprule name="Origin-State-Id" maximum="1"/>
					<avprule name="Error-Message" maximum="1"/>
					<avprule name="Error-Reporting-Host" maximum="1"/>
					<avprule name="Failed-AVP"/>
					<avprule name="Redirect-Host"/>
					<avprule name="Redirect-Host-Usage" maximum="1"/>
					<avprule name="Proxy-Info"/>
					<avprule name="AVP"/>
				</optional>
			</answerrules>
		</command>
	</application>
</dictionary>
