<?xml version="1.0" encoding="UTF-8"?>
<!-- <!DOCTYPE dictionary SYSTEM "dictionary.dtd"> -->

<dictionary>

	<!-- ************* DIAMETER NASREQ APPLICATION ************* -->
	<application id="1" name="NASREQ" uri="http://www.ietf.org/rfc/rfc4005.txt">
		<command name="AA" code="265" application-id="1" abbreviation="AA">
			<requestrules>
				<fixed>
					<avprule name="Session-Id" maximum="1" minimum="1"/>
				</fixed>
				<required>
					<avprule name="Auth-Application-Id" maximum="1" minimum="1"/>
					<avprule name="Origin-Host" maximum="1" minimum="1"/>
					<avprule name="Origin-Realm" maximum="1" minimum="1"/>
					<avprule name="Destination-Realm" maximum="1" minimum="1"/>
					<avprule name="Auth-Request-Type" maximum="1" minimum="1"/>
				</required>
				<optional>
					<avprule name="Destination-Host" maximum="1"/>
					<avprule name="NAS-Identifier" maximum="1" />
					<avprule name="NAS-IP-Address" maximum="1" />
					<avprule name="NAS-IPv6-Address" maximum="1" />
					<avprule name="NAS-Port" maximum="1"/>
					<avprule name="NAS-Port-Id" maximum="1" />
					<avprule name="NAS-Port-Type" maximum="1" />
					<avprule name="Origin-AAA-Protocol" maximum="1" />
					<avprule name="Origin-State-Id" maximum="1" />
					<avprule name="Port-Limit" maximum="1" />
					<avprule name="User-Name" maximum="1" />
					<avprule name="User-Password" maximum="1" />
					<avprule name="NAS-Service-Type" maximum="1" />
					<avprule name="State" maximum="1" />
					<avprule name="Authorization-Lifetime" maximum="1" />
					<avprule name="Auth-Grace-Period" maximum="1" />
					<avprule name="Auth-Session-State" maximum="1" />
					<avprule name="Callback-Number" maximum="1" />
					<avprule name="Called-Station-Id" maximum="1" />
					<avprule name="Calling-Station-Id" maximum="1" />
					<avprule name="Originating-Line-Info" maximum="1" />
					<avprule name="Connect-Info" maximum="1" />
					<avprule name="CHAP-Auth" maximum="1" />
					<avprule name="CHAP-Challenge" maximum="1" />
					<avprule name="Framed-Compression"/>
					<avprule name="Framed-Interface-Id" maximum="1" />
					<avprule name="Framed-IP-Address" maximum="1" />
					<avprule name="Framed-IPv6-Prefix"/>
					<avprule name="Framed-IP-Netmask" maximum="1" />
					<avprule name="Framed-MTU" maximum="1" />
					<avprule name="Framed-Protocol" maximum="1" />
					<avprule name="ARAP-Password" maximum="1" />
					<avprule name="ARAP-Security" maximum="1" />
					<avprule name="ARAP-Security-Data"/>
					<avprule name="Login-IP-Host"/>
					<avprule name="Login-IPv6-Host"/>
					<avprule name="Login-LAT-Group" maximum="1" />
					<avprule name="Login-LAT-Node" maximum="1" />
					<avprule name="Login-LAT-Port" maximum="1" />
					<avprule name="Login-LAT-Service" maximum="1" />
					<avprule name="Tunneling"/>
					<avprule name="Proxy-Info"/>
					<avprule name="Route-Record"/>
					<avprule name="AVP"/>
				</optional>
			</requestrules>
			<answerrules>
				<fixed>
					<avprule name="Session-Id" maximum="1" minimum="1"/>
				</fixed>
				<required>
					<avprule name="Auth-Application-Id" maximum="1" minimum="1"/>
					<avprule name="Auth-Request-Type" maximum="1" minimum="1"/>
					<avprule name="Result-Code" maximum="1" minimum="1"/>
					<avprule name="Origin-Host" maximum="1" minimum="1"/>
					<avprule name="Origin-Realm" maximum="1" minimum="1"/>
				</required>
				<optional>
					<avprule name="User-Name" maximum="1" />
					<avprule name="NAS-Service-Type" maximum="1" />
					<avprule name="Class"/>
					<avprule name="Configuration-Token"/>
					<avprule name="Acct-Interim-Interval" maximum="1" />
					<avprule name="Error-Message" maximum="1" />
					<avprule name="Error-Reporting-Host" maximum="1" />
					<avprule name="Failed-AVP"/>
					<avprule name="Idle-Timeout" maximum="1" />
					<avprule name="Authorization-Lifetime" maximum="1" />
					<avprule name="Auth-Grace-Period" maximum="1" />
					<avprule name="Auth-Session-State" maximum="1" />
					<avprule name="Re-Auth-Request-Type" maximum="1" />
					<avprule name="Multi-Round-Time-Out" maximum="1" />
					<avprule name="Session-Timeout" maximum="1" />
					<avprule name="State" maximum="1" />
					<avprule name="Reply-Message"/>
					<avprule name="Origin-AAA-Protocol"/>
					<avprule name="Origin-State-Id" maximum="1" />
					<avprule name="Filter-Id"/>
					<avprule name="Password-Retry" maximum="1" />
					<avprule name="Port-Limit" maximum="1" />
					<avprule name="Prompt" maximum="1" />
					<avprule name="ARAP-Challenge-Response" maximum="1" />
					<avprule name="ARAP-Features" maximum="1" />
					<avprule name="ARAP-Security" maximum="1" />
					<avprule name="ARAP-Security-Data"/>
					<avprule name="ARAP-Zone-Access" maximum="1" />
					<avprule name="Callback-Id" maximum="1" />
					<avprule name="Callback-Number" maximum="1" />
					<avprule name="Framed-Appletalk-Link" maximum="1" />
					<avprule name="Framed-Appletalk-Network"/>
					<avprule name="Framed-Appletalk-Zone" maximum="1" />
					<avprule name="Framed-Compression"/>
					<avprule name="Framed-Interface-Id" maximum="1" />
					<avprule name="Framed-IP-Address" maximum="1" />
					<avprule name="Framed-IPv6-Prefix"/>
					<avprule name="Framed-IPv6-Pool" maximum="1" />
					<avprule name="Framed-IPv6-Route"/>
					<avprule name="Framed-IP-Netmask" maximum="1" />
					<avprule name="Framed-Route"/>
					<avprule name="Framed-Pool" maximum="1" />
					<avprule name="Framed-IPX-Network" maximum="1" />
					<avprule name="Framed-MTU" maximum="1" />
					<avprule name="Framed-Protocol" maximum="1" />
					<avprule name="Framed-Routing" maximum="1" />
					<avprule name="Login-IP-Host"/>
					<avprule name="Login-IPv6-Host"/>
					<avprule name="Login-LAT-Group" maximum="1" />
					<avprule name="Login-LAT-Node" maximum="1" />
					<avprule name="Login-LAT-Port" maximum="1" />
					<avprule name="Login-LAT-Service" maximum="1" />
					<avprule name="Login-Service" maximum="1" />
					<avprule name="Login-TCP-Port" maximum="1" />
					<avprule name="NAS-Filter-Rule"/>
					<avprule name="QoS-Filter-Rule"/>
					<avprule name="Tunneling"/>
					<avprule name="Redirect-Host"/>
					<avprule name="Redirect-Host-Usage" maximum="1" />
					<avprule name="Redirect-Max-Cache-Time" maximum="1" />
					<avprule name="Proxy-Info"/>
					<avprule name="AVP"/>
				</optional>
			</answerrules>
		</command>
	</application>

</dictionary>

