<?xml version="1.0" encoding="UTF-8"?>
<!-- <!DOCTYPE dictionary SYSTEM "dictionary.dtd"> -->

<dictionary>
	<!-- ***************** Base Protocol Definition ******************* -->
	<base uri="http://www.ietf.org/rfc/rfc6733.txt">
		<!-- *********************** Commands *************************** -->
		<!-- Diameter Base Protocol Command Codes -->
		<command name="Capabilities-Exchange" code="257" abbreviation="CE" proxiable="false">
			<requestrules>
				<required>
					<avprule name="Origin-Host" maximum="1" minimum="1"/>
					<avprule name="Origin-Realm" maximum="1" minimum="1"/>
					<avprule name="Host-IP-Address" minimum="1"/>
					<avprule name="Vendor-Id" maximum="1" minimum="1"/>
					<avprule name="Product-Name" maximum="1" minimum="1"/>
				</required>
				<optional>
					<avprule name="Origin-State-Id" maximum="1"/>
					<avprule name="Supported-Vendor-Id"/>
					<avprule name="Auth-Application-Id"/>
					<avprule name="Acct-Application-Id"/>
					<avprule name="Vendor-Specific-Application-Id"/>
					<avprule name="Firmware-Revision" maximum="1"/>
					<avprule name="Inband-Security-Id" maximum="1"/>
					<avprule name="AVP"/>
				</optional>
			</requestrules>
			<answerrules>
				<required>
					<avprule name="Result-Code" maximum="1" minimum="1"/>
					<avprule name="Origin-Host" maximum="1" minimum="1"/>
					<avprule name="Origin-Realm" maximum="1" minimum="1"/>
					<avprule name="Host-IP-Address" minimum="1"/>
					<avprule name="Vendor-Id" maximum="1" minimum="1"/>
					<avprule name="Product-Name" maximum="1" minimum="1"/>
				</required>
				<optional>
					<avprule name="Origin-State-Id" maximum="1"/>
					<avprule name="Error-Message" maximum="1"/>
					<avprule name="Failed-AVP"/>
					<avprule name="Supported-Vendor-Id"/>
					<avprule name="Auth-Application-Id"/>
					<avprule name="Acct-Application-Id"/>
					<avprule name="Vendor-Specific-Application-Id"/>
					<avprule name="Firmware-Revision" maximum="1"/>
					<avprule name="AVP"/>
				</optional>
			</answerrules>
		</command>

		<command name="Device-Watchdog" code="280" abbreviation="DW" proxiable="false">
			<requestrules>
				<required>
					<avprule name="Origin-Host" maximum="1" minimum="1"/>
					<avprule name="Origin-Realm" maximum="1" minimum="1"/>
				</required>
				<optional>
					<avprule name="Origin-State-Id" maximum="1"/>
				</optional>
			</requestrules>
			<answerrules>
				<required>
					<avprule name="Result-Code" maximum="1" minimum="1"/>
					<avprule name="Origin-Host" maximum="1" minimum="1"/>
					<avprule name="Origin-Realm" maximum="1" minimum="1"/>
				</required>
				<optional>
					<avprule name="Error-Message" maximum="1"/>
					<avprule name="Failed-AVP"/>
					<avprule name="Origin-State-Id" maximum="1"/>
				</optional>
			</answerrules>
		</command>

		<command name="Disconnect-Peer" code="282" abbreviation="DP" proxiable="false">
			<requestrules>
				<required>
					<avprule name="Origin-Host" maximum="1" minimum="1"/>
					<avprule name="Origin-Realm" maximum="1" minimum="1"/>
					<avprule name="Disconnect-Cause" maximum="1" minimum="1"/>
				</required>
			</requestrules>
			<answerrules>
				<required>
					<avprule name="Result-Code" maximum="1" minimum="1"/>
					<avprule name="Origin-Host" maximum="1" minimum="1"/>
					<avprule name="Origin-Realm" maximum="1" minimum="1"/>
				</required>
				<optional>
					<avprule name="Error-Message" maximum="1"/>
					<avprule name="Failed-AVP"/>
				</optional>
			</answerrules>
		</command>

		<command name="Re-Auth" code="258" abbreviation="RA">
			<requestrules>
				<fixed>
					<avprule name="Session-Id" maximum="1" minimum="1"/>
				</fixed>
				<required>
					<avprule name="Origin-Host" maximum="1" minimum="1"/>
					<avprule name="Origin-Realm" maximum="1" minimum="1"/>
					<avprule name="Destination-Realm" maximum="1" minimum="1"/>
					<avprule name="Destination-Host" maximum="1" minimum="1"/>
					<avprule name="Auth-Application-Id" maximum="1" minimum="1"/>
					<avprule name="Re-Auth-Request-Type" maximum="1" minimum="1"/>
				</required>
				<optional>
					<avprule name="User-Name" maximum="1"/>
					<avprule name="Origin-State-Id" maximum="1"/>
					<avprule name="Proxy-Info"/>
					<avprule name="Route-Record"/>
					<avprule name="AVP"/>
				</optional>
			</requestrules>
			<answerrules>
				<fixed>
					<avprule name="Session-Id" maximum="1" minimum="1"/>
				</fixed>
				<required>
					<avprule name="Result-Code" maximum="1" minimum="1"/>
					<avprule name="Origin-Host" maximum="1" minimum="1"/>
					<avprule name="Origin-Realm" maximum="1" minimum="1"/>
				</required>
				<optional>
					<avprule name="User-Name" maximum="1"/>
					<avprule name="Origin-State-Id" maximum="1"/>
					<avprule name="Error-Message" maximum="1"/>
					<avprule name="Error-Reporting-Host" maximum="1"/>
					<avprule name="Failed-AVP"/>
					<avprule name="Redirect-Host"/>
					<avprule name="Redirect-Host-Usage" maximum="1"/>
					<avprule name="Redirect-Max-Cache-Time" maximum="1"/>
					<avprule name="Proxy-Info"/>
					<avprule name="AVP"/>
				</optional>
			</answerrules>
		</command>

		<!-- Diameter Base Protocol Abort-Session Command -->
		<command name="Abort-Session" code="274" abbreviation="AS" proxiable="true">
			<requestrules>
				<fixed>
					<avprule name="Session-Id" maximum="1" minimum="1"/>
				</fixed>
				<required>
					<avprule name="Origin-Host" maximum="1" minimum="1"/>
					<avprule name="Origin-Realm" maximum="1" minimum="1"/>
					<avprule name="Destination-Realm" maximum="1" minimum="1"/>
					<avprule name="Destination-Host" maximum="1" minimum="1"/>
					<avprule name="Auth-Application-Id" maximum="1" minimum="1"/>
				</required>
				<optional>
					<avprule name="User-Name" maximum="1"/>
					<avprule name="Origin-State-Id" maximum="1"/>
					<avprule name="AVP"/>
					<avprule name="Proxy-Info"/>
					<avprule name="Route-Record"/>
				</optional>
			</requestrules>
			<answerrules>
				<fixed>
					<avprule name="Session-Id" maximum="1" minimum="1"/>
				</fixed>
				<required>
					<avprule name="Result-Code" maximum="1" minimum="1"/>
					<avprule name="Origin-Host" maximum="1" minimum="1"/>
					<avprule name="Origin-Realm" maximum="1" minimum="1"/>
				</required>
				<optional>
					<avprule name="User-Name" maximum="1"/>
					<avprule name="Origin-State-Id" maximum="1"/>
					<avprule name="Error-Message" maximum="1"/>
					<avprule name="Error-Reporting-Host" maximum="1"/>
					<avprule name="Failed-AVP"/>
					<avprule name="Redirect-Host"/>
					<avprule name="Redirect-Host-Usage" maximum="1"/>
					<avprule name="Proxy-Info"/>
					<avprule name="AVP"/>
				</optional>
			</answerrules>
		</command>

		<command name="Session-Termination" code="275" abbreviation="ST" proxiable="true">
			<requestrules>
				<fixed>
					<avprule name="Session-Id" maximum="1" minimum="1"/>
				</fixed>
				<required>
					<avprule name="Origin-Host" maximum="1" minimum="1"/>
					<avprule name="Origin-Realm" maximum="1" minimum="1"/>
					<avprule name="Destination-Realm" maximum="1" minimum="1"/>
					<avprule name="Auth-Application-Id" maximum="1" minimum="1"/>
					<avprule name="Termination-Cause" maximum="1" minimum="1"/>
				</required>
				<optional>
					<avprule name="User-Name" maximum="1"/>
					<avprule name="Destination-Host" maximum="1"/>
					<avprule name="Class"/>
					<avprule name="Origin-State-Id" maximum="1"/>
					<avprule name="Proxy-Info"/>
					<avprule name="Route-Record"/>
					<avprule name="AVP"/>
				</optional>
			</requestrules>
			<answerrules>
				<fixed>
					<avprule name="Session-Id" maximum="1" minimum="1"/>
				</fixed>
				<required>
					<avprule name="Result-Code" maximum="1" minimum="1"/>
					<avprule name="Origin-Host" maximum="1" minimum="1"/>
					<avprule name="Origin-Realm" maximum="1" minimum="1"/>
				</required>
				<optional>
					<avprule name="User-Name" maximum="1"/>
					<avprule name="Class"/>
					<avprule name="Error-Message" maximum="1"/>
					<avprule name="Error-Reporting-Host" maximum="1"/>
					<avprule name="Failed-AVP"/>
					<avprule name="Origin-State-Id" maximum="1"/>
					<avprule name="Redirect-Host"/>
					<avprule name="Redirect-Host-Usage" maximum="1"/>
					<avprule name="Redirect-Max-Cache-Time" maximum="1"/>
					<avprule name="Proxy-Info"/>
					<avprule name="AVP"/>
				</optional>
			</answerrules>
		</command>

		<!-- ********************** End Commands ************************ -->
	</base>
	<!-- ************** END DIAMETER BASE PROTOCOL AVPS ************* -->

</dictionary>
